{
  "domain": "home.hermes",
  "title": "Hermes_OS",
  "description": "The official Hermes_OS landing page for Hermes Internet.",
  "entry": "/",
  "routes": {
    "/": "pages/index.html",
    "/interactive": "pages/interactive.html",
    "/games": "pages/games.html",
    "/games/snake": "pages/games_snake.html"
  },
  "agent_visible": true
}
